{
  "id": "carrierId",
  "label": "配送会社",
  "type": "string",
  "direction": "input",
  "required": true,
  "options": [
    { "value": "yamato", "label": "ヤマト運輸" },
    { "value": "sagawa", "label": "佐川急便" },
    { "value": "japanpost", "label": "日本郵便" }
  ],
  "errorMessages": {
    "required": "配送会社を選択してください。"
  },
  "events": [
    {
      "id": "submit",
      "label": "配送指示登録",
      "handlerFlowId": "d63c703c-26ed-4704-8b76-329c6bfae9c9",
      "argumentMapping": {
        "orderId": "@screen.orderId",
        "carrierId": "@screen.carrierId",
        "preferredDate": "@screen.preferredDate",
        "timeSlot": "@screen.timeSlot"
      }
    }
  ],
  "description": "S-4 配送指示フォームの配送会社選択。"
}
