{
  "id": "storeFilter",
  "label": "店舗",
  "type": "string",
  "direction": "input",
  "required": true,
  "options": [
    { "value": "S-001", "label": "東京本店" },
    { "value": "S-002", "label": "大阪支店" },
    { "value": "S-003", "label": "名古屋支店" }
  ],
  "events": [
    {
      "id": "change",
      "label": "在庫照会",
      "handlerFlowId": "efa7ac6e-e295-416e-b68d-17c4739b5097",
      "argumentMapping": {
        "storeCode": "@screen.storeFilter",
        "productCode": "@screen.productCodeFilter"
      }
    }
  ],
  "description": "S-1 在庫一覧の店舗フィルタ。"
}
